<?xml version="1.0" encoding="utf-8" ?>
<!DOCTYPE Localizations SYSTEM "../localizations.dtd">
<Localizations language="en-US">
    <Localization id="LogIn__SignUp__FirstName">
        <Message>Please signup here {markup, html, {name}}.</Message>
        <Parameters>
            <Parameter name="name">
                <Type language="TypeScript">string</Type>
            </Parameter>
            <Parameter name="age">
                <Type language="TypeScript">number</Type>
            </Parameter>
        </Parameters>
        <Files>
            <File language="TypeScript">src/app/home_page.ts</File>
        </Files>
        <Timestamp>2017-10-31T20:21:23Z</Timestamp>
        <Comment>Signup field.</Comment>
    </Localization>
</Localizations>
